{
  "$schema": "https://raw.githubusercontent.com/DjobaDELATV/seygo_data/main/schema/v1/skill.json",
  "id": "98c1bff2-7de3-4272-9a39-aebf1be921ee",
  "text": {
    "en": {
      "name": "Geological Survey (Skill)",
      "effect": "Look at up to 3 cards from the top of your Deck, then place them on the top of the Deck in the same order.This Skill can only be used once per turn and twice per Duel."
    },
    "fr": {
      "name": "Analyse G\u00e9ologique",
      "effect": "Regardez jusqu'\u00e0 3 cartes du dessus de votre Deck, puis placez-les au-dessus du Deck dans le m\u00eame ordre.Cette Comp\u00e9tence ne peut \u00eatre utilis\u00e9e qu'une fois par tour et deux fois par Duel."
    },
    "ja": {
      "name": ""
    }
  },
  "cardType": "skill-dl",
  "skillType": "Legendary",
  "releases": [
    {
      "character": "Jim \"Crocodile\" Cook (Duel Links)",
      "type": "duel_reward"
    }
  ],
  "externalIDs": {
    "yugipedia": [
      {
        "name": "Geological Survey (Skill)",
        "id": 715097
      }
    ]
  }
}