{
  "$schema": "https://raw.githubusercontent.com/DjobaDELATV/seygo_data/main/schema/v1/skill.json",
  "id": "8898932d-ce34-4643-a437-d376b7f03301",
  "text": {
    "en": {
      "name": "Tachyon Transmigration (Skill)",
      "effect": "Can be used when you have a \"Number\" monster on your field with \"107\" in its name that activated their effect 2 or more times.\nSet 1 \"Tachyon Transmigration\" to your field from outside of your Deck.\nThis Skill can only be used once per Duel if you begin the Duel with a Deck fulfilling the following conditions:\n* Monsters in your Deck are only Dragon-Type monsters.\n* Monsters in your Extra Deck are only Dragon-Type Xyz Monsters."
    },
    "fr": {
      "name": "Transmigration Tachyon",
      "effect": "Utilisable seulement si vous avez un monstre \"Num\u00e9ro\" sur votre Terrain avec \"107\" dans son nom et qui a activ\u00e9 son effet au moins 2 fois.\nPosez 1 \"Transmigration Tachyon\" sur votre Terrain depuis l'ext\u00e9rieur de votre Deck.\nCette Comp\u00e9tence ne peut \u00eatre utilis\u00e9e qu'une fois par Duel si vous commencez le Duel avec un Deck qui remplit les conditions suivantes :\n* Votre Deck ne contient que des monstres de Type Dragon.\n* Votre Extra Deck ne contient que des Monstres Xyz de Type Dragon."
    },
    "ja": {
      "name": "\u30bf\u30ad\u30aa\u30f3\u30fb\u30c8\u30e9\u30f3\u30b9\u30df\u30b0\u30ec\u30a4\u30b7\u30e7\u30f3",
      "effect": "\u81ea\u5206\u30d5\u30a3\u30fc\u30eb\u30c9\u306b\uff12\u56de\u4ee5\u4e0a\u52b9\u679c\u3092\u767a\u52d5\u3057\u305f\u5143\u3005\u306e\u30ab\u30fc\u30c9\u540d\u306b\u300c\uff2e\uff4f\uff0e\uff11\uff10\uff17\u300d\u3092\u542b\u3080\u30e2\u30f3\u30b9\u30bf\u30fc\u304c\u5b58\u5728\u3059\u308b\u5834\u5408\u306b\u4f7f\u7528\u3067\u304d\u308b\u3002\u30c7\u30c3\u30ad\u5916\u304b\u3089\u300c\u30bf\u30ad\u30aa\u30f3\u30fb\u30c8\u30e9\u30f3\u30b9\u30df\u30b0\u30ec\u30a4\u30b7\u30e7\u30f3\u300d\uff11\u679a\u3092\u81ea\u5206\u30d5\u30a3\u30fc\u30eb\u30c9\u4e0a\u306b\u30bb\u30c3\u30c8\u3059\u308b\u3002\u3053\u306e\u30b9\u30ad\u30eb\u306f\u4ee5\u4e0b\u306e\u6761\u4ef6\u3092\u6e80\u305f\u3057\u305f\u30c7\u30c3\u30ad\u3092\u8a2d\u5b9a\u3057\u3066\u30c7\u30e5\u30a8\u30eb\u3092\u958b\u59cb\u3057\u305f\u5834\u5408\u306b\u3001\u30c7\u30e5\u30a8\u30eb\u4e2d\uff11\u5ea6\u306e\u307f\u4f7f\u7528\u3067\u304d\u308b\u3002\n\u25cf\u30c7\u30c3\u30ad\u306e\u30e2\u30f3\u30b9\u30bf\u30fc\u304c\u30c9\u30e9\u30b4\u30f3\u65cf\u30e2\u30f3\u30b9\u30bf\u30fc\u306e\u307f\n\u25cf\u30a8\u30af\u30b9\u30c8\u30e9\u30c7\u30c3\u30ad\u306e\u30e2\u30f3\u30b9\u30bf\u30fc\u304c\u30c9\u30e9\u30b4\u30f3\u65cf\u306e\u30a8\u30af\u30b7\u30fc\u30ba\u30e2\u30f3\u30b9\u30bf\u30fc\u306e\u307f"
    }
  },
  "cardType": "skill-dl",
  "skillType": "Legendary",
  "supports": [
    "Tachyon Transmigration (Duel Links)",
    "Dragon",
    "Xyz Monster"
  ],
  "releases": [
    {
      "character": "Mizar (Duel Links)",
      "type": "duel_reward"
    }
  ],
  "externalIDs": {
    "yugipedia": [
      {
        "name": "Tachyon Transmigration (Skill)",
        "id": 1041926
      }
    ]
  }
}