{
  "$schema": "https://raw.githubusercontent.com/DjobaDELATV/seygo_data/main/schema/v1/skill.json",
  "id": "681ce702-7c7f-44ad-9698-02c100ffa87a",
  "text": {
    "en": {
      "name": "Sentrification",
      "effect": "Turn all \"Giant Soldier of Stone\" in your Graveyard into \"Sentry Soldier of Stone.\" This Skill can only be used once per Duel."
    },
    "fr": {
      "name": "Sentinification",
      "effect": "Transformez toutes les Cartes \"Soldat G\u00e9ant de Pierre\" de votre Cimeti\u00e8re en \"Soldat Sentinelle de Pierre\". Cette Comp\u00e9tence ne peut \u00eatre utilis\u00e9e qu'une fois par Duel."
    },
    "ja": {
      "name": ""
    }
  },
  "cardType": "skill-dl",
  "skillType": "Legendary",
  "supports": [
    "Giant Soldier of Stone (Duel Links)",
    "Sentry Soldier of Stone (Duel Links)"
  ],
  "releases": [
    {
      "character": "Yugi Muto (DSOD) (Duel Links)",
      "type": "duel_reward"
    }
  ],
  "externalIDs": {
    "yugipedia": [
      {
        "name": "Sentrification",
        "id": 716638
      }
    ]
  }
}