{
  "$schema": "https://raw.githubusercontent.com/DjobaDELATV/seygo_data/main/schema/v1/skill.json",
  "id": "353ae005-0e12-49ef-ab1d-6f2793f2a7e3",
  "text": {
    "en": {
      "name": "Stardust Acceleration",
      "effect": "You can use this Skill's second and third effects once per Duel if your Extra Deck contains \"Stardust Dragon\".\n1: You cannot Special Summon any monsters from your Extra Deck, except \"Warrior\", \"Junk\", or \"Synchron\" Synchro Monsters, and WIND or LIGHT monsters with a Level.\n2: Reveal 1 \"Synchron\" monster in your hand and shuffle 1 card from your hand into the Deck, then add 1 \"On Your Mark, Get Set, DUEL!\" from your Deck to your hand.\n3. Send 1 card from your hand or field to the Graveyard, then, from outside of your Deck, play 1 \"Wheel Synchron\", add 6 different Synchro Monsters to your Extra Deck, and send 3 different monsters to your Graveyard. (These 3 cards can be Special Summoned.)"
    },
    "fr": {
      "name": "Stardust Acceleration",
      "effect": "Vous pouvez utiliser le deuxi\u00e8me et le troisi\u00e8me effet de cette Comp\u00e9tence une fois par Duel si votre Extra Deck contient \"Dragon Poussi\u00e8re d'\u00c9toile\".\n1 : Vous ne pouvez pas Invoquer Sp\u00e9cialement de monstre depuis votre Extra Deck, except\u00e9 des Monstres Synchro \"Guerrier\", \"Robot\" ou \"Synchronique\" et des monstres VENT ou LUMI\u00c8RE avec un Niveau.\n2 : R\u00e9v\u00e9lez 1 monstre \"Synchronique\" de votre main et m\u00e9langez 1 carte de votre main dans le Deck, puis ajoutez 1 \"\u00c0 vos Marques, Pr\u00eats, DUEL !\" de votre Deck \u00e0 votre main.\n3. Envoyez 1 carte de votre main ou Terrain au Cimeti\u00e8re, puis, depuis l'ext\u00e9rieur de votre Deck, jouez 1 \"Roue Synchronique\", ajoutez 6 diff\u00e9rents Monstres Synchro \u00e0 votre Extra Deck, et envoyez 3 monstres diff\u00e9rents dans votre Cimeti\u00e8re. (Ces 3 cartes peuvent \u00eatre Invoqu\u00e9es Sp\u00e9cialement.)"
    },
    "ja": {
      "name": "\u30b9\u30bf\u30fc\u30c0\u30b9\u30c8\u30fb\u30a2\u30af\u30bb\u30e9\u30ec\u30fc\u30b7\u30e7\u30f3",
      "effect": "\u3053\u306e\u30b9\u30ad\u30eb\u306e\u2461\u2462\u306e\u52b9\u679c\u306f\u300c\u30b9\u30bf\u30fc\u30c0\u30b9\u30c8\u30fb\u30c9\u30e9\u30b4\u30f3\u300d\u3092\uff25\uff38\u30c7\u30c3\u30ad\u306b\u5165\u308c\u3066\u3044\u308b\u30c7\u30c3\u30ad\u3067\u3001\u305d\u308c\u305e\u308c\u30c7\u30e5\u30a8\u30eb\u4e2d\u306b\uff11\u5ea6\u305a\u3064\u4f7f\u7528\u3067\u304d\u308b\u3002\n\u2460\uff1a\u81ea\u5206\u306f\u300c\u30a6\u30a9\u30ea\u30a2\u30fc\u300d\u300c\u30b8\u30e3\u30f3\u30af\u300d\u300c\u30b7\u30f3\u30af\u30ed\u30f3\u300d\u30b7\u30f3\u30af\u30ed\u30e2\u30f3\u30b9\u30bf\u30fc\u53ca\u3073\u30ec\u30d9\u30eb\u3092\u6301\u3064\u98a8\u30fb\u5149\u5c5e\u6027\u30e2\u30f3\u30b9\u30bf\u30fc\u3057\u304b\uff25\uff38\u30c7\u30c3\u30ad\u304b\u3089\u7279\u6b8a\u53ec\u559a\u3067\u304d\u306a\u3044\u3002\n\u2461\uff1a\u624b\u672d\u306e\u300c\u30b7\u30f3\u30af\u30ed\u30f3\u300d\u30e2\u30f3\u30b9\u30bf\u30fc\uff11\u4f53\u3092\u76f8\u624b\u306b\u898b\u305b\u3001\u624b\u672d\u3092\uff11\u679a\u30c7\u30c3\u30ad\u306b\u623b\u3057\u3066\u767a\u52d5\u3067\u304d\u308b\u3002\u30c7\u30c3\u30ad\u304b\u3089\u300c\u30e9\u30a4\u30c7\u30a3\u30f3\u30b0\u30fb\u30c7\u30e5\u30a8\u30eb\uff01\u30a2\u30af\u30bb\u30e9\u30ec\u30fc\u30b7\u30e7\u30f3\uff01\u300d\uff11\u679a\u3092\u624b\u672d\u306b\u52a0\u3048\u308b\u3002\n\u2462\uff1a\u81ea\u5206\u306e\u624b\u672d\u30fb\u30d5\u30a3\u30fc\u30eb\u30c9\u306e\u30ab\u30fc\u30c9\uff11\u679a\u3092\u5893\u5730\u3078\u9001\u3063\u3066\u767a\u52d5\u3067\u304d\u308b\u3002\u30c7\u30c3\u30ad\u5916\u304b\u3089\u3001\u300c\u30db\u30a4\u30fc\u30eb\u30fb\u30b7\u30f3\u30af\u30ed\u30f3\u300d\uff11\u4f53\u3092\u51fa\u3057\u3001\u30b7\u30f3\u30af\u30ed\u30e2\u30f3\u30b9\u30bf\u30fc\uff16\u7a2e\u985e\u3092\uff11\u4f53\u305a\u3064\uff25\uff38\u30c7\u30c3\u30ad\u306b\u52a0\u3048\u3001\u30e2\u30f3\u30b9\u30bf\u30fc\uff13\u7a2e\u985e\u3092\uff11\u4f53\u305a\u3064\u7279\u6b8a\u53ec\u559a\u53ef\u80fd\u306a\u72b6\u614b\u3067\u5893\u5730\u3078\u9001\u308b\u3002"
    }
  },
  "cardType": "skill-dl",
  "skillType": "Legendary",
  "supports": [
    "Stardust Dragon (Duel Links)",
    "On Your Mark, Get Set, DUEL! (Duel Links)",
    "Wheel Synchron (Duel Links)",
    "Shooting Star Dragon (Duel Links)",
    "Junk Destroyer (Duel Links)",
    "Junk Archer (Duel Links)",
    "Junk Warrior (Duel Links)",
    "Stardust Warrior (Duel Links)",
    "Jet Warrior (Duel Links)",
    "Formula Synchron (Duel Links)",
    "Sonic Chick (Duel Links)",
    "Speed Warrior (Duel Links)",
    "WIND",
    "LIGHT"
  ],
  "supportsArchetypes": [
    "Warrior (archetype)",
    "Junk",
    "Synchron"
  ],
  "releases": [
    {
      "character": "Yusei Fudo (Duel Links)",
      "type": "trader"
    }
  ],
  "externalIDs": {
    "yugipedia": [
      {
        "name": "Stardust Acceleration (Skill)",
        "id": 1117477
      }
    ]
  }
}