{
  "$schema": "https://raw.githubusercontent.com/DjobaDELATV/seygo_data/main/schema/v1/skill.json",
  "id": "482de439-2fc5-48b6-8935-ef9f01ffe3f2",
  "text": {
    "en": {
      "name": "Ancient Gear Engineering",
      "effect": "You can only use this Skill's second and third effects once per turn.1: You cannot Normal or Special Summon (excluding Special Summons from the Extra Deck) any monsters, except EARTH Machine monsters.2: Reveal 1 \"Ancient Gear Golem\" or 1 monster that mentions it in your hand and shuffle 1 card from your hand into the Deck, then add 1 \"Ancient Gear\" monster from your Deck to your hand.\n3: If your opponent activated an effect during your current turn, place 1 \"Ancient Gear Duel\" from your hand or Deck face-up to your field. You can conduct 2 Normal Summons/Sets this turn, not just 1."
    },
    "fr": {
      "name": "Ingi\u00e9nierie des Rouages Ancients",
      "effect": "Vous pouvez utiliser les deuxi\u00e8me et troisi\u00e8me effets de cette Comp\u00e9tence une fois par tour.1 : Vous ne pouvez pas Invoquer Normalement ou Sp\u00e9cialement aucun monstre (except\u00e9 les Invocations Sp\u00e9ciales de l'Extra Deck), sauf des monstres Machine TERRE.2 : R\u00e9v\u00e9lez 1 \"Golem Rouages Ancients\" ou une carte qui en fait mention dans votre main et m\u00e9langez 1 carte de votre main dans le Deck, puis ajoutez 1 monstre \"Rouages Ancients\" de votre Deck \u00e0 votre main.3 : Si votre adversaire a activ\u00e9 un effet pendant votre tour actuel, placez 1 \"Duel Rouages Ancients\" depuis votre main ou Deck sur votre Terrain face recto. Ce tour, vous pouvez mener 2 Invocations/Poses Normales, pas uniquement 1."
    }
  },
  "cardType": "skill-dl",
  "skillType": "Legendary",
  "supports": [
    "Ancient Gear Golem (Duel Links)",
    "Ancient Gear Duel (Duel Links)",
    "EARTH",
    "Machine"
  ],
  "supportsArchetypes": [
    "Ancient Gear"
  ],
  "releases": [
    {
      "character": "Dr. Vellian Crowler (Duel Links)",
      "type": "trader"
    }
  ],
  "externalIDs": {
    "yugipedia": [
      {
        "name": "Ancient Gear Engineering",
        "id": 1125726
      }
    ]
  }
}