{
  "$schema": "https://raw.githubusercontent.com/DjobaDELATV/seygo_data/main/schema/v1/skill.json",
  "id": "dfde4f4a-4e93-47c3-91a6-1199714cee6f",
  "text": {
    "en": {
      "name": "New Possibilities for Me and Aqua!",
      "effect": "You can only use this Skill's second effect once per Duel.\n1: At the beginning of the Duel, add 1 \"Marincess Great Bubble Reef\" and 1 \"Marincess Coral Anemone\" to your Extra Deck. (You can only have at most 3 copies of each card.)\n2: If you control a Link Monster, play 1 \"Marincess\" monster from your Graveyard in face-up Defense Position."
    },
    "fr": {
      "name": "Nouvelles possibilit\u00e9s pour Aqua et moi !",
      "effect": "Vous ne pouvez utiliser le deuxi\u00e8me effet de cette Comp\u00e9tence qu'une fois par Duel.\n1 : Au d\u00e9but du Duel, ajoutez 1 \"R\u00e9cif Grande Bulle Marincesse\" et 1 \"An\u00e9mone Corallienne Marincesse\" \u00e0 votre Extra Deck (vous ne pouvez avoir que 3 exemplaires de chaque carte).\n2 : Si vous contr\u00f4lez un Monstre Lien, jouez 1 monstre \"Marincesse\" depuis votre Cimeti\u00e8re en Position de D\u00e9fense face recto."
    },
    "ja": {
      "name": ""
    }
  },
  "cardType": "skill-dl",
  "skillType": "Legendary",
  "supports": [
    "Marincess Great Bubble Reef (Duel Links)",
    "Marincess Coral Anemone (Duel Links)"
  ],
  "supportsArchetypes": [
    "Marincess"
  ],
  "releases": [
    {
      "character": "Blue Angel (Duel Links)",
      "type": "mission",
      "details": "Blue Maiden and Aqua unlock"
    }
  ],
  "externalIDs": {
    "yugipedia": [
      {
        "name": "New Possibilities for Me and Aqua!",
        "id": 1215298
      }
    ]
  }
}