{
  "$schema": "https://raw.githubusercontent.com/DjobaDELATV/seygo_data/main/schema/v1/skill.json",
  "id": "7a80f8b7-03ff-4495-98a9-c10379306ea3",
  "text": {
    "en": {
      "name": "I Rule Over Every Dragon",
      "effect": "Can be used when the only monsters on your field are 2 Dragon-Type LIGHT monsters.\nAll the monsters on your field are set to Level 8 until the end of the turn.\nOn the turn you use this Skill, you can only Special Summon Rank 8/9 Dragon-Type LIGHT Xyz Monsters. If you set a Deck that fulfills the following conditions and begin the Duel, this Skill can only be used once per Duel.\n* Monsters in your Deck are only Dragon-Type monsters.\n* Monsters in your Extra Deck are only Dragon-Type Xyz Monsters."
    },
    "fr": {
      "name": "Je suis le Ma\u00eetre de tous les Dragons",
      "effect": "Utilisable seulement si les seuls monstres sur votre Terrain sont 2 monstres de Type Dragon LUMI\u00c8RE.\nLe Niveau de tous les monstres sur votre Terrain passe \u00e0 8 jusqu'\u00e0 la fin du tour.\nLors du tour pendant lequel vous utilisez cette Comp\u00e9tence, vous pouvez uniquement Invoquer Sp\u00e9cialement des Monstres Xyz de Type Dragon LUMI\u00c8RE de Rang 8 et 9.\nSi vous cr\u00e9ez un Deck qui remplit les conditions suivantes et que vous commencez le Duel, cette Comp\u00e9tence ne peut \u00eatre utilis\u00e9e qu'une fois par Duel.\n* Votre Deck ne contient que des monstres de Type Dragon.\n* Votre Extra Deck ne contient que des Monstres Xyz de Type Dragon."
    },
    "ja": {
      "name": "\u6700\u5f37\u306e\u30c9\u30e9\u30b4\u30f3\u4f7f\u3044\u306f\u3053\u306e\u79c1\u3060",
      "effect": "\u81ea\u5206\u30d5\u30a3\u30fc\u30eb\u30c9\u306e\u30e2\u30f3\u30b9\u30bf\u30fc\u304c\u30c9\u30e9\u30b4\u30f3\u65cf\u30fb\u5149\u5c5e\u6027\u30e2\u30f3\u30b9\u30bf\u30fc\uff12\u4f53\u306e\u307f\u306e\u5834\u5408\u306b\u4f7f\u7528\u3067\u304d\u308b\u3002\u81ea\u5206\u30d5\u30a3\u30fc\u30eb\u30c9\u306e\u30e2\u30f3\u30b9\u30bf\u30fc\u5168\u3066\u306e\u30ec\u30d9\u30eb\u3092\u30bf\u30fc\u30f3\u7d42\u4e86\u6642\u307e\u3067\uff18\u306b\u3059\u308b\u3002\u3053\u306e\u30b9\u30ad\u30eb\u3092\u4f7f\u7528\u3057\u305f\u30bf\u30fc\u30f3\u3001\u81ea\u5206\u306f\u30e9\u30f3\u30af\uff18\u30fb\uff19\u306e\u30c9\u30e9\u30b4\u30f3\u65cf\u30fb\u5149\u5c5e\u6027\u30a8\u30af\u30b7\u30fc\u30ba\u30e2\u30f3\u30b9\u30bf\u30fc\u3057\u304b\u7279\u6b8a\u53ec\u559a\u3067\u304d\u306a\u3044\u3002\u3053\u306e\u30b9\u30ad\u30eb\u306f\u4ee5\u4e0b\u306e\u6761\u4ef6\u3092\u6e80\u305f\u3057\u305f\u30c7\u30c3\u30ad\u3092\u8a2d\u5b9a\u3057\u3066\u30c7\u30e5\u30a8\u30eb\u3092\u958b\u59cb\u3057\u305f\u5834\u5408\u306b\u3001\u30c7\u30e5\u30a8\u30eb\u4e2d\uff11\u5ea6\u306e\u307f\u4f7f\u7528\u3067\u304d\u308b\u3002\n\u25cf\u30c7\u30c3\u30ad\u306e\u30e2\u30f3\u30b9\u30bf\u30fc\u304c\u30c9\u30e9\u30b4\u30f3\u65cf\u30e2\u30f3\u30b9\u30bf\u30fc\u306e\u307f\n\u25cf\u30a8\u30af\u30b9\u30c8\u30e9\u30c7\u30c3\u30ad\u306e\u30e2\u30f3\u30b9\u30bf\u30fc\u304c\u30c9\u30e9\u30b4\u30f3\u65cf\u306e\u30a8\u30af\u30b7\u30fc\u30ba\u30e2\u30f3\u30b9\u30bf\u30fc\u306e\u307f"
    }
  },
  "cardType": "skill-dl",
  "skillType": "Legendary",
  "supports": [
    "LIGHT",
    "Dragon",
    "Xyz Monster"
  ],
  "releases": [
    {
      "character": "Mizar (Duel Links)",
      "type": "duel_reward"
    }
  ],
  "externalIDs": {
    "yugipedia": [
      {
        "name": "I Rule Over Every Dragon",
        "id": 1041817
      }
    ]
  }
}