{
  "$schema": "https://raw.githubusercontent.com/DjobaDELATV/seygo_data/main/schema/v1/skill.json",
  "id": "45125b9a-0a1f-4330-9bee-b2913984ffc2",
  "text": {
    "en": {
      "name": "Dinosaur's Exchange",
      "effect": "You can use this Skill's first effect twice per Duel.\n1: During your Main Phase, place 1 Level 5 or higher Dinosaur monster from your hand on the bottom of the Deck, then draw 1 card."
    },
    "fr": {
      "name": "\u00c9change de Dinosaure",
      "effect": "Vous pouvez utiliser le premier effet de cette Comp\u00e9tence deux fois par Duel.\n1 : Pendant votre Main Phase, placez 1 monstre Dinosaure de Niveau 5 ou plus de votre main au-dessous du Deck, puis piochez 1 carte."
    },
    "ja": {
      "name": ""
    }
  },
  "cardType": "skill-dl",
  "skillType": "Legendary",
  "supports": [
    "Dinosaur"
  ],
  "releases": [
    {
      "character": "Rex Raptor (Duel Links)",
      "type": "trader"
    },
    {
      "character": "Tyranno Hassleberry (Duel Links)",
      "type": "trader"
    },
    {
      "character": "The Gore (Duel Links)",
      "type": "trader"
    }
  ],
  "externalIDs": {
    "yugipedia": [
      {
        "name": "Dinosaur's Exchange",
        "id": 1117486
      }
    ]
  }
}