{
  "$schema": "https://raw.githubusercontent.com/DjobaDELATV/seygo_data/main/schema/v1/skill.json",
  "id": "06f4350c-af4f-4a87-9be6-a112faf4a55e",
  "text": {
    "en": {
      "name": "Burst Trigger",
      "effect": "1: At the beginning of your first turn, add 1 \"Polymerization\" from outside your Deck to your hand. During this Duel, you can only Fusion Summon \"Blue-Eyes\" Fusion Monsters."
    },
    "fr": {
      "name": "Amorce Explosive",
      "effect": "1 : Au d\u00e9but de votre premier tour, ajoutez 1 \"Polym\u00e9risation\" \u00e0 votre main depuis l'ext\u00e9rieur de votre Deck. Pendant ce Duel, vous ne pouvez Invoquer par Fusion que des Monstres Fusion \"Yeux Bleus\"."
    },
    "ja": {
      "name": ""
    }
  },
  "cardType": "skill-dl",
  "skillType": "Legendary",
  "supports": [
    "Polymerization (Duel Links)",
    "Fusion Monster"
  ],
  "supportsArchetypes": [
    "Blue-Eyes"
  ],
  "releases": [
    {
      "character": "Seto Kaiba (Duel Links)",
      "type": "box",
      "details": "Character Deck (Kaiba Deck)"
    }
  ],
  "externalIDs": {
    "yugipedia": [
      {
        "name": "Burst Trigger",
        "id": 1182982
      }
    ]
  }
}