{
  "$schema": "https://raw.githubusercontent.com/DjobaDELATV/seygo_data/main/schema/v1/skill.json",
  "id": "69009247-bfcb-4a9a-ab7d-aa1bf46167b1",
  "text": {
    "en": {
      "name": "Extra, Extra",
      "effect": "Can be used when your Life Points decrease by 2000. During your Draw Phase, add to your hand 1 copy of the card you drew as your normal draw.\nThis Skill can only be used once per Duel."
    },
    "fr": {
      "name": "Encore, encore",
      "effect": "Comp\u00e9tence qui peut \u00eatre utilis\u00e9e quand vos Life Points diminuent de 2 000. En Draw Phase, ajoutez \u00e0 votre main 1 exemplaire de la carte re\u00e7ue en pioche normale.\nCette Comp\u00e9tence ne peut \u00eatre utilis\u00e9e qu'une fois par Duel."
    },
    "ja": {
      "name": "\u5897\u5237",
      "effect": "\u81ea\u5206\u306e\u30e9\u30a4\u30d5\u30dd\u30a4\u30f3\u30c8\u304c\uff12\uff10\uff10\uff10\u6e1b\u3063\u305f\u5f8c\u3001\u81ea\u5206\u306e\u30c9\u30ed\u30fc\u30d5\u30a7\u30a4\u30ba\u306e\u30c9\u30ed\u30fc\u524d\u306b\u4f7f\u7528\u3067\u304d\u308b\u3002\u901a\u5e38\u306e\u30c9\u30ed\u30fc\u3067\u5f15\u3044\u305f\u30ab\u30fc\u30c9\uff11\u679a\u3092\uff12\u679a\u306b\u8907\u88fd\u3059\u308b\u3002\n\u3053\u306e\u30b9\u30ad\u30eb\u306f\u30c7\u30e5\u30a8\u30eb\u4e2d\uff11\u5ea6\u3057\u304b\u4f7f\u7528\u3067\u304d\u306a\u3044\u3002"
    }
  },
  "cardType": "skill-dl",
  "skillType": "Legendary",
  "releases": [
    {
      "character": "Maximillion Pegasus (Duel Links)",
      "type": "duel_reward"
    }
  ],
  "externalIDs": {
    "yugipedia": [
      {
        "name": "Extra, Extra",
        "id": 714902
      }
    ]
  }
}