{
  "$schema": "https://raw.githubusercontent.com/DjobaDELATV/seygo_data/main/schema/v1/skill.json",
  "id": "3cd4a379-c3e6-4691-bf55-28eed5d0916c",
  "text": {
    "en": {
      "name": "Plant's Exchange",
      "effect": "This Skill can be used twice per Duel.1: During your Main Phase, place 1 Level 5 or higher Plant Type monster from your hand to the bottom of your Deck, and then draw 1 card."
    },
    "fr": {
      "name": "Transaction Plante",
      "effect": "Cette Comp\u00e9tence peut \u00eatre utilis\u00e9e deux fois par Duel.1 : Au d\u00e9but de votre Main Phase, placez 1 monstre de Type Plante de Niveau 5 ou plus de votre main au-dessous de votre Deck, puis piochez 1 carte."
    }
  },
  "cardType": "skill-dl",
  "skillType": "Legendary",
  "supports": [
    "Plant"
  ],
  "releases": [
    {
      "character": "Akiza Izinski (Duel Links)",
      "type": "trader"
    },
    {
      "character": "Luna (Duel Links)",
      "type": "trader"
    },
    {
      "character": "Yuri (Duel Links)",
      "type": "duel_reward"
    },
    {
      "character": "Spectre (Duel Links)",
      "type": "trader"
    }
  ],
  "externalIDs": {
    "yugipedia": [
      {
        "name": "Plant's Exchange",
        "id": 1101599
      }
    ]
  }
}