{
  "$schema": "https://raw.githubusercontent.com/DjobaDELATV/seygo_data/main/schema/v1/skill.json",
  "id": "13e2ce22-3f33-4c10-9330-c23260ea5d78",
  "text": {
    "en": {
      "name": "Bear Parade",
      "effect": "Each of the following effects can be used once per turn and once per Duel by selecting 1 \"Frightfur Bear\" you control.\n* Select 1 monster in your opponent's Graveyard and equip it to this card as an Equip Card. The card equipped counts as having been equipped by the effect of this \"Frightfur Bear\".\n* During this turn, the selected monster gains an additional attack for each card it has equipped."
    },
    "fr": {
      "name": "Parade de l'ours",
      "effect": "Chacun des effets suivants peut \u00eatre utilis\u00e9 une fois par tour et une fois par Duel en s\u00e9lectionnant 1 \"Ours Frourreur\" que vous contr\u00f4lez.\n* S\u00e9lectionnez 1 monstre dans le Cimeti\u00e8re de votre adversaire et \u00e9quipez-le \u00e0 cette carte en tant que Carte d'\u00c9quipement. La carte \u00e9quip\u00e9e compte comme ayant \u00e9t\u00e9 \u00e9quip\u00e9e par l'effet de cette Carte \"Ours Frourreur\".\n* Lors de ce tour, le monstre s\u00e9lectionn\u00e9 gagne une attaque suppl\u00e9mentaire pour chaque carte qu'il a \u00e9quip\u00e9e."
    },
    "ja": {
      "name": ""
    }
  },
  "cardType": "skill-dl",
  "skillType": "Legendary",
  "supports": [
    "Frightfur Bear (Duel Links)"
  ],
  "releases": [
    {
      "character": "Sora Perse (Duel Links)",
      "type": "level_up",
      "details": "Level 20"
    }
  ],
  "externalIDs": {
    "yugipedia": [
      {
        "name": "Bear Parade",
        "id": 713584
      }
    ]
  }
}