{
  "$schema": "https://raw.githubusercontent.com/DjobaDELATV/seygo_data/main/schema/v1/skill.json",
  "id": "7a7dbe2c-f459-498a-8841-6f26afaf5713",
  "text": {
    "en": {
      "name": "Deck Master: \"Kaiser Sea Horse\"",
      "effect": "You can only use this Skill's first and second effects once per Duel.1: During your Main Phase, play 1 \"Kaiser Sea Horse\" from outside your Deck in face-down Defense Position. (Its battle position can be changed.)2: If you control \"Kaiser Sea Horse\", you can Normal Summon a LIGHT monster with 1 less Tribute this turn."
    },
    "fr": {
      "name": ""
    },
    "ja": {
      "name": ""
    }
  },
  "cardType": "skill-dl",
  "skillType": "Legendary",
  "supports": [
    "Kaiser Sea Horse (Duel Links)",
    "LIGHT"
  ],
  "releases": [
    {
      "character": "Seto Kaiba (Duel Links)",
      "type": "mission",
      "details": "Style mission reward"
    },
    {
      "character": "Seto Kaiba (Duel Links)",
      "type": "mission",
      "details": "Win 5 Duel(s) with \"Kaiser Sea Horse\" in your Deck, while playing as Seto Kaiba (Urban)."
    }
  ],
  "externalIDs": {
    "yugipedia": [
      {
        "name": "Deck Master: \"Kaiser Sea Horse\"",
        "id": 1151867
      }
    ]
  }
}