{
  "$schema": "https://raw.githubusercontent.com/DjobaDELATV/seygo_data/main/schema/v1/skill.json",
  "id": "1c23679a-b236-4daf-8a04-dc7301bfe997",
  "text": {
    "en": {
      "name": "Extra Pain",
      "effect": "When you deal battle damage to your opponent, deal an additional 100 damage.\nThis Skill will not activate if your opponent has 1000 Life Points or less."
    },
    "fr": {
      "name": "Douleur suppl\u00e9mentaire",
      "effect": "Lorsque vous infligez des dommages de combat \u00e0 votre adversaire, infligez 100 dommages suppl\u00e9mentaires.\nCette Comp\u00e9tence ne s'active pas si votre adversaire a 1 000 Life Points ou moins."
    },
    "ja": {
      "name": "\u4eca\u56de\u306e\u30c6\u30fc\u30de\u306f\u2026\u2026\u300c\u75db\u307f\u300d\u3060\u3041\uff01\uff01",
      "effect": "\u76f8\u624b\u306b\u6226\u95d8\u30c0\u30e1\u30fc\u30b8\u3092\u4e0e\u3048\u305f\u5834\u5408\u3001\u3055\u3089\u306b\u76f8\u624b\u306b\uff15\uff10\u30dd\u30a4\u30f3\u30c8\u306e\u75db\u307f\u3092\u4e0e\u3048\u308b\u3002\u3053\u306e\u30b9\u30ad\u30eb\u306f\u76f8\u624b\u306e\u30e9\u30a4\u30d5\u30dd\u30a4\u30f3\u30c8\u304c\uff11\uff10\uff10\uff10\u4ee5\u4e0b\u306e\u5834\u5408\u9069\u7528\u3055\u308c\u306a\u3044\u3002"
    }
  },
  "cardType": "skill-dl",
  "skillType": "Legendary",
  "releases": [
    {
      "character": "Scud (Duel Links)",
      "type": "level_up",
      "details": "Level 13"
    }
  ],
  "externalIDs": {
    "yugipedia": [
      {
        "name": "Extra Pain",
        "id": 714899
      }
    ]
  }
}