{
  "$schema": "https://raw.githubusercontent.com/DjobaDELATV/seygo_data/main/schema/v1/skill.json",
  "id": "54d0c823-454a-4855-82ba-c2152cb1d42e",
  "text": {
    "en": {
      "name": "Destiny Board (Skill)",
      "effect": "Can be used if \"Dark Necrofear\" is in your Graveyard, and your Life Points are at 2000 or below.\nAt the end of your fifth turn after activating this Skill, you win the Duel.\nThis Skill is negated if \"Dark Necrofear\" leaves your Graveyard.\nThis Skill can only be used once per Duel."
    },
    "fr": {
      "name": "Tableau de la Destin\u00e9e",
      "effect": "Comp\u00e9tence qui peut \u00eatre utilis\u00e9e si \"Necrofear des T\u00e9n\u00e8bres\" est dans votre Cimeti\u00e8re et si vos Life Points sont \u00e0 2 000 ou moins.\n\u00c0 la fin de votre cinqui\u00e8me tour apr\u00e8s l'activation de cette Comp\u00e9tence, vous gagnez le Duel.\nCette Comp\u00e9tence est annul\u00e9e si \"Necrofear des T\u00e9n\u00e8bres\" quitte votre Cimeti\u00e8re.\nCette Comp\u00e9tence ne peut \u00eatre utilis\u00e9e qu'une fois par Duel."
    },
    "ja": {
      "name": "\u30a6\u30a3\u30b8\u30e3\u76e4",
      "effect": "\u81ea\u5206\u306e\u5893\u5730\u306b\u300c\u30c0\u30fc\u30af\u30fb\u30cd\u30af\u30ed\u30d5\u30a3\u30a2\u300d\u304c\u5b58\u5728\u3057\u3001\u30e9\u30a4\u30d5\u30dd\u30a4\u30f3\u30c8\u304c\uff12\uff10\uff10\uff10\u4ee5\u4e0b\u306e\u5834\u5408\u306b\u4f7f\u7528\u3067\u304d\u308b\u3002\n\u30b9\u30ad\u30eb\u4f7f\u7528\u5f8c\uff15\u56de\u76ee\u306e\u81ea\u5206\u306e\u30bf\u30fc\u30f3\u7d42\u4e86\u6642\u306b\u30c7\u30e5\u30a8\u30eb\u306b\u52dd\u5229\u3059\u308b\u3002\n\u300c\u30c0\u30fc\u30af\u30fb\u30cd\u30af\u30ed\u30d5\u30a3\u30a2\u300d\u304c\u81ea\u5206\u306e\u5893\u5730\u304b\u3089\u96e2\u308c\u305f\u3068\u304d\u3001\u3053\u306e\u30b9\u30ad\u30eb\u306f\u7121\u52b9\u306b\u306a\u308b\u3002\n\u3053\u306e\u30b9\u30ad\u30eb\u306f\u30c7\u30e5\u30a8\u30eb\u4e2d\uff11\u5ea6\u3057\u304b\u4f7f\u7528\u3067\u304d\u306a\u3044\u3002"
    }
  },
  "cardType": "skill-dl",
  "skillType": "Legendary",
  "supports": [
    "Dark Necrofear (Duel Links)"
  ],
  "releases": [
    {
      "character": "Yami Bakura (Duel Links)",
      "type": "duel_reward"
    }
  ],
  "externalIDs": {
    "yugipedia": [
      {
        "name": "Destiny Board (Skill)",
        "id": 714521
      }
    ]
  }
}