{
  "$schema": "https://raw.githubusercontent.com/DjobaDELATV/seygo_data/main/schema/v1/skill.json",
  "id": "92fea460-0a43-4063-859c-3d7f2bda70be",
  "text": {
    "en": {
      "name": "Barian Battlemorph! Sargasso, the Dark Realm",
      "effect": "You can only use this Skill's second effect once per turn.\n1: At the beginning of the Duel, place 1 \"Sargasso the D.D. Battlefield\" from outside of your Deck face-up in your Field Zone. During this Duel, you can only Normal or Special Summon \"Star Seraph\" monsters (excluding Special Summons from the Extra Deck).\n2: Shuffle 1 card from your hand into the Deck and reveal 1 \"Sargasso Lighthouse\" or \"Sargasso the D.D. Battlefield\" in your hand. Barian Battlemorph! Regain your true form! Add 1 \"Star Seraph\" monster from your Deck to your hand and play 1 \"Star Seraph Sage\" from outside of your Deck to your field in face-down Defense Position. (Its battle position can be changed.)"
    },
    "fr": {
      "name": "Transformation de combat Barian ! Sargasso, le Royaume des T\u00e9n\u00e8bres",
      "effect": "Vous pouvez utiliser le deuxi\u00e8me effet de cette Comp\u00e9tence une fois par tour.\n1 : Au d\u00e9but du Duel, placez 1 \"Champ de Bataille D.D. de Sargasso\" dans votre Zone Terrain face recto depuis l'ext\u00e9rieur de votre Deck. Pendant ce Duel, vous pouvez uniquement Invoquer Normalement ou Sp\u00e9cialement des monstres \"S\u00e9raphin \u00c9toile\" (hors Invocations Sp\u00e9ciales depuis l'Extra Deck).\n2 : M\u00e9langez 1 carte de votre main dans le Deck et r\u00e9v\u00e9lez 1 \"Phare de Sargasso\" ou \"Champ de Bataille D.D. de Sargasso\" dans votre main. Transformation de combat Barian ! Retrouve ta forme v\u00e9ritable ! Ajoutez 1 monstre \"S\u00e9raphin \u00c9toile\" depuis votre Deck \u00e0 votre main et jouez 1 \"Sage S\u00e9raphin \u00c9toile\" depuis l'ext\u00e9rieur de votre Deck sur votre Terrain en Position de D\u00e9fense face verso. (Sa position de combat peut \u00eatre modifi\u00e9e.)"
    },
    "ja": {
      "name": "\u30d0\u30ea\u30a2\u30eb\u30d5\u30a9\u30fc\u30bc \uff0d\u9b54\u5883\u30b5\u30eb\u30ac\u30c3\u30bd\uff0d",
      "effect": "\u3053\u306e\u30b9\u30ad\u30eb\u306e\u2461\u306e\u52b9\u679c\u306f\uff11\u30bf\u30fc\u30f3\u306b\uff11\u5ea6\u3057\u304b\u4f7f\u7528\u3067\u304d\u306a\u3044\u3002\n\u2460\uff1a\u30c7\u30e5\u30a8\u30eb\u958b\u59cb\u6642\u306b\u767a\u52d5\u3059\u308b\u3002\u30c7\u30c3\u30ad\u5916\u304b\u3089\u300c\u7570\u6b21\u5143\u306e\u53e4\u6226\u5834\uff0d\u30b5\u30eb\u30ac\u30c3\u30bd\u300d\uff11\u679a\u3092\u81ea\u5206\u306e\u30d5\u30a3\u30fc\u30eb\u30c9\u30be\u30fc\u30f3\u306b\u8868\u5074\u8868\u793a\u3067\u7f6e\u304f\u3002\u3053\u306e\u30c7\u30e5\u30a8\u30eb\u4e2d\u3001\u81ea\u5206\u306f\u300c\u5149\u5929\u4f7f\u300d\u30e2\u30f3\u30b9\u30bf\u30fc\u3057\u304b\u53ec\u559a\u30fb\u7279\u6b8a\u53ec\u559a\u3067\u304d\u306a\u3044\uff08\uff25\uff38\u30c7\u30c3\u30ad\u304b\u3089\u306e\u7279\u6b8a\u53ec\u559a\u3092\u9664\u304f\uff09\u3002\n\u2461\uff1a\u624b\u672d\u3092\uff11\u679a\u30c7\u30c3\u30ad\u306b\u623b\u3057\u3001\u624b\u672d\u306e\u300c\u30b5\u30eb\u30ac\u30c3\u30bd\u306e\u706f\u53f0\u300d\u304b\u300c\u7570\u6b21\u5143\u306e\u53e4\u6226\u5834\uff0d\u30b5\u30eb\u30ac\u30c3\u30bd\u300d\uff11\u679a\u3092\u76f8\u624b\u306b\u898b\u305b\u3066\u767a\u52d5\u3067\u304d\u308b\u3002\u30d0\u30ea\u30a2\u30eb\u30d5\u30a9\u30fc\u30bc\u3057\u3001\u771f\u306e\u59ff\u306b\u306a\u308b\uff01\n\u30c7\u30c3\u30ad\u304b\u3089\u300c\u5149\u5929\u4f7f\u300d\u30e2\u30f3\u30b9\u30bf\u30fc\uff11\u4f53\u3092\u624b\u672d\u306b\u52a0\u3048\u3001\u30c7\u30c3\u30ad\u5916\u304b\u3089\u300c\u5149\u5929\u4f7f\u30d6\u30c3\u30af\u30b9\u300d\uff11\u4f53\u3092\u88cf\u5074\u5b88\u5099\u8868\u793a\u3067\u51fa\u3059\uff08\u8868\u793a\u5f62\u5f0f\u5909\u66f4\u53ef\u80fd\uff09\u3002"
    }
  },
  "cardType": "skill-dl",
  "skillType": "Legendary",
  "supports": [
    "Sargasso the D.D. Battlefield (Duel Links)",
    "Sargasso Lighthouse (Duel Links)",
    "Star Seraph Sage (Duel Links)"
  ],
  "supportsArchetypes": [
    "Star Seraph"
  ],
  "releases": [
    {
      "character": "Dumon (Duel Links)",
      "type": "duel_reward"
    }
  ],
  "externalIDs": {
    "yugipedia": [
      {
        "name": "Barian Battlemorph! Sargasso, the Dark Realm",
        "id": 1075310
      }
    ]
  }
}