{
  "$schema": "https://raw.githubusercontent.com/DjobaDELATV/seygo_data/main/schema/v1/skill.json",
  "id": "eefd3c50-bb34-4d0d-a163-059062038c3c",
  "text": {
    "en": {
      "name": "Speedroid Gear Changer",
      "effect": "Can be used during a turn on which you have not Special Summoned any monsters. Send 1 \"Speedroid\" monster you control to your Graveyard, and then add 1 \"Speedroid\" monster whose original Level is 1 higher or lower than that monster to your hand from your Deck.\nYou cannot Special Summon during the turn you activate this Skill, except for Synchro Summoning.\nThis Skill can only be used once per Duel."
    },
    "fr": {
      "name": "Changeur de vitesse - Vitesseroid",
      "effect": "Cette Comp\u00e9tence peut \u00eatre utilis\u00e9e lors d'un tour durant lequel vous n'avez fait aucune Invocation Sp\u00e9ciale. Envoyez 1 Monstre \"Vitesseroid\" que vous contr\u00f4lez dans votre Cimeti\u00e8re, puis ajoutez 1 Monstre \"Vitesseroid\" dont le Niveau d'origine est inf\u00e9rieur ou sup\u00e9rieur de 1 \u00e0 ce monstre \u00e0 votre main depuis votre Deck.\nVous ne pouvez pas Invoquer Sp\u00e9cialement durant le tour o\u00f9 vous activez cette Comp\u00e9tence, Invocations Synchro except\u00e9es.\nCette Comp\u00e9tence ne peut \u00eatre utilis\u00e9e qu'une fois par Duel."
    },
    "ja": {
      "name": "\uff33\uff32\u30ae\u30a2\u30c1\u30a7\u30f3\u30b8",
      "effect": "\u7279\u6b8a\u53ec\u559a\u3092\u3057\u3066\u3044\u306a\u3044\u30bf\u30fc\u30f3\u306b\u4f7f\u7528\u3067\u304d\u308b\u3002\u81ea\u5206\u30d5\u30a3\u30fc\u30eb\u30c9\u306e\u300c\u30b9\u30d4\u30fc\u30c9\u30ed\u30a4\u30c9\u300d\u30e2\u30f3\u30b9\u30bf\u30fc\uff11\u4f53\u3092\u5893\u5730\u3078\u9001\u308a\u3001\u5893\u5730\u3078\u9001\u3063\u305f\u30e2\u30f3\u30b9\u30bf\u30fc\u306e\u5143\u3005\u306e\u30ec\u30d9\u30eb\u3088\u308a\u30ec\u30d9\u30eb\u304c\uff11\u3064\u9ad8\u3044\u307e\u305f\u306f\u4f4e\u3044\u300c\u30b9\u30d4\u30fc\u30c9\u30ed\u30a4\u30c9\u300d\u30e2\u30f3\u30b9\u30bf\u30fc\uff11\u4f53\u3092\u30c7\u30c3\u30ad\u304b\u3089\u624b\u672d\u306b\u52a0\u3048\u308b\u3002\n\u3053\u306e\u30b9\u30ad\u30eb\u3092\u4f7f\u7528\u3057\u305f\u30bf\u30fc\u30f3\u3001\u81ea\u5206\u306f\u30b7\u30f3\u30af\u30ed\u53ec\u559a\u4ee5\u5916\u306e\u7279\u6b8a\u53ec\u559a\u304c\u3067\u304d\u306a\u3044\u3002\n\u3053\u306e\u30b9\u30ad\u30eb\u306f\u30c7\u30e5\u30a8\u30eb\u4e2d\u306b\uff11\u5ea6\u306e\u307f\u4f7f\u7528\u3067\u304d\u308b\u3002"
    }
  },
  "cardType": "skill-dl",
  "skillType": "Legendary",
  "supports": [
    "Synchro Monster"
  ],
  "supportsArchetypes": [
    "Speedroid"
  ],
  "releases": [
    {
      "character": "Yugo (Duel Links)",
      "type": "event",
      "details": "Full Speed Ahead! The Turbo Duelist, Yugo!"
    }
  ],
  "externalIDs": {
    "yugipedia": [
      {
        "name": "Speedroid Gear Changer",
        "id": 1054725
      }
    ]
  }
}