{
  "$schema": "https://raw.githubusercontent.com/DjobaDELATV/seygo_data/main/schema/v1/skill.json",
  "id": "35058e3a-cafb-493b-a834-842221640d49",
  "text": {
    "en": {
      "name": "The Mother Tree Sees All",
      "effect": "1: At the beginning of the Duel, add 1 \"Sunavalon Dryatrentiay\" to your Extra Deck and if there are two or less \"Sunseed Genius Loci\" in your Deck, add 0-3 \"Sunseed Genius Loci\" so that it contains 3 copies.\nDuring the End Phase, if you took battle or effect damage this turn, gain 500 LP."
    },
    "fr": {
      "name": "L'arbre M\u00e8re voit tout",
      "effect": "1 : Au d\u00e9but du Duel, ajoutez 1 Carte \"Dryarbre Solairavalon\" \u00e0 votre Extra Deck et s'il y a 2 Cartes \"Astucieux Loci Solairgraine\" ou moins dans votre Deck, ajoutez jusqu'\u00e0 3 Cartes \"Astucieux Loci Solairgraine\" pour qu'il contienne 3 exemplaires.\n2 : Pendant la End Phase, si vous avez subi des dommages de combat ou d'effet pendant ce tour, gagnez 500 LP."
    },
    "ja": {
      "name": "\u6211\u304c\u6bcd\u306a\u308b\u5927\u6a39\u306b\u6b7b\u89d2\u306f\u3042\u308a\u307e\u305b\u3093\u3088",
      "effect": "\u2460\uff1a\u30c7\u30e5\u30a8\u30eb\u958b\u59cb\u6642\u306b\u767a\u52d5\u3059\u308b\u3002\uff25\uff38\u30c7\u30c3\u30ad\u306b\u300c\u8056\u5929\u6a39\u306e\u5927\u6bcd\u795e\u300d\u3092\uff11\u4f53\u8ffd\u52a0\u3059\u308b\u3002\u30c7\u30c3\u30ad\u306e\u300c\u8056\u7a2e\u306e\u5730\u970a\u300d\u304c\uff12\u679a\u4ee5\u4e0b\u306e\u5834\u5408\u3001\uff13\u679a\u306b\u306a\u308b\u3088\u3046\u306b\u30c7\u30c3\u30ad\u306b\u300c\u8056\u7a2e\u306e\u5730\u970a\u300d\u3092\u8ffd\u52a0\u3059\u308b\u3002\n\u2461\uff1a\u81ea\u5206\u304c\u6226\u95d8\u30fb\u52b9\u679c\u3067\u30c0\u30e1\u30fc\u30b8\u3092\u53d7\u3051\u305f\u30bf\u30fc\u30f3\u306e\u30a8\u30f3\u30c9\u30d5\u30a7\u30a4\u30ba\u306b\u767a\u52d5\u3059\u308b\u3002\u81ea\u5206\u306f\uff15\uff10\uff10\uff2c\uff30\u56de\u5fa9\u3059\u308b\u3002"
    }
  },
  "cardType": "skill-dl",
  "skillType": "Legendary",
  "supports": [
    "Sunavalon Dryatrentiay (Duel Links)",
    "Sunseed Genius Loci (Duel Links)"
  ],
  "releases": [
    {
      "character": "Spectre (Duel Links)",
      "type": "level_up",
      "details": "Level 1"
    }
  ],
  "externalIDs": {
    "yugipedia": [
      {
        "name": "The Mother Tree Sees All",
        "id": 1060965
      }
    ]
  }
}