{
  "$schema": "https://raw.githubusercontent.com/DjobaDELATV/seygo_data/main/schema/v1/skill.json",
  "id": "d17e14c6-0c17-43be-9e27-f11a9f51cd32",
  "text": {
    "en": {
      "name": "Maiden of Iron",
      "effect": "Halve the battle damage you take from battles involving \"Maiden in Love.\""
    },
    "fr": {
      "name": "Jeune Fille de Fer",
      "effect": "Divise par deux les dommages de combat que vous recevez dans les combats impliquant la Carte \"Jeune Fille Amoureuse\"."
    },
    "ja": {
      "name": "\u4e59\u5973\u306e\u30ac\u30fc\u30c9\u306f\u56fa\u3044\u306e\u3088\uff01",
      "effect": "\u81ea\u5206\u306e\u300c\u604b\u3059\u308b\u4e59\u5973\u300d\u304c\u6226\u95d8\u3092\u884c\u3046\u5834\u5408\u3001\u81ea\u5206\u3078\u306e\u6226\u95d8\u30c0\u30e1\u30fc\u30b8\u306f\u534a\u5206\u306b\u306a\u308b\u3002"
    }
  },
  "cardType": "skill-dl",
  "skillType": "Legendary",
  "supports": [
    "Maiden in Love (Duel Links)"
  ],
  "releases": [
    {
      "character": "Blair Flannigan (Duel Links)",
      "type": "level_up",
      "details": "Level 4"
    }
  ],
  "externalIDs": {
    "yugipedia": [
      {
        "name": "Maiden of Iron",
        "id": 715748
      }
    ]
  }
}