{
  "$schema": "https://raw.githubusercontent.com/DjobaDELATV/seygo_data/main/schema/v1/skill.json",
  "id": "a042f8d6-7307-4f51-b28f-8760d43dcdec",
  "text": {
    "en": {
      "name": "Infinite Power of the Timelords",
      "effect": "Play 1 \"Timelord\" monster in your hand to your field in face-up Attack Position.\nThis Skill can be used once per turn if you control \"Infinite Light\"."
    },
    "fr": {
      "name": "Puissance infinie des Seigneurs du temps",
      "effect": "Jouez 1 monstre \"Seigneur du Temps\" dans votre main sur votre Terrain en Position d'Attaque face recto.\nCette Comp\u00e9tence peut \u00eatre utilis\u00e9e une fois par tour si vous contr\u00f4lez \"Lumi\u00e8re Infinie\"."
    },
    "ja": {
      "name": "\u6642\u68b0\u795e\u306e\u7121\u9650\u306e\u529b",
      "effect": "\u624b\u672d\u306e\u300c\u6642\u68b0\u795e\u300d\u30e2\u30f3\u30b9\u30bf\u30fc\uff11\u4f53\u3092\u8868\u5074\u653b\u6483\u8868\u793a\u3067\u30d5\u30a3\u30fc\u30eb\u30c9\u306b\u51fa\u3059\u3002\n\u3053\u306e\u30b9\u30ad\u30eb\u306f\uff11\u30bf\u30fc\u30f3\u306b\uff11\u5ea6\u3001\u81ea\u5206\u30d5\u30a3\u30fc\u30eb\u30c9\u4e0a\u306b\u300c\u7121\u9650\u5149\u30a2\u30a4\u30f3\u30fb\u30bd\u30d5\u30fb\u30aa\u30a6\u30eb\u300d\u304c\u5b58\u5728\u3059\u308b\u5834\u5408\u306b\u4f7f\u7528\u3067\u304d\u308b\u3002"
    }
  },
  "cardType": "skill-dl",
  "skillType": "Legendary",
  "supports": [
    "Infinite Light (Duel Links)"
  ],
  "supportsArchetypes": [
    "Timelord"
  ],
  "releases": [
    {
      "character": "Z-one (Duel Links)",
      "type": "duel_reward"
    }
  ],
  "externalIDs": {
    "yugipedia": [
      {
        "name": "Infinite Power of the Timelords",
        "id": 1029163
      }
    ]
  }
}