{
  "$schema": "https://raw.githubusercontent.com/DjobaDELATV/seygo_data/main/schema/v1/skill.json",
  "id": "ff21051c-44bd-4fab-91a7-b36d3c9e9ddb",
  "text": {
    "en": {
      "name": "Dragonic Contact",
      "effect": "You can use this Skill's second effect once per turn if your Deck contains \"Rainbow Dragon\".\n1: You cannot Special Summon monsters, except \"Neos\", \"Yubel\", \"Elemental HERO\", and \"Neo-Spacian\" monsters.\n2: Send 1 Warrior monster or Level 10 monster from your hand or face-up field to the Graveyard, then play 1 of the following monsters from your Deck or Graveyard in face-down Defense Position (its battle position can be changed), and add 1 \"Super Polymerization\" from your Deck and 1 \"Polymerization\" from outside of your Deck to your hand.\n\u25cf \"Elemental HERO Neos\"\n\u25cf \"Ultimate Crystal\" monster\n\u25cf WIND \"Armed Dragon\" monster (treated as having been Special Summoned by the effect of an \"Armed Dragon\" monster)"
    },
    "fr": {
      "name": "Contact Draconique",
      "effect": "Vous pouvez utiliser le deuxi\u00e8me effet de cette Comp\u00e9tence une fois par tour si votre Deck contient \"Dragon Arc-en-Ciel\".\n1 : Vous ne pouvez pas Invoquer Sp\u00e9cialement de monstres, except\u00e9 les monstres \"N\u00e9os\", \"Yubel\", \"H\u00c9ROS \u00c9l\u00e9mentaire\" et \"N\u00e9o-Spacien\".\n2 : Envoyez 1 monstre de Type Guerrier ou un monstre de Niveau 10 de votre main ou de votre Terrain face recto au Cimeti\u00e8re, puis jouez 1 des monstres suivants de votre Main ou de votre Cimeti\u00e8re en Position de D\u00e9fense face verso (sa position de combat peut \u00eatre modifi\u00e9e), et ajoutez 1 \"Super Polym\u00e9risation\" de votre Deck et 1 \"Polym\u00e9risation\" \u00e0 votre main depuis l'ext\u00e9rieur de votre Deck.\n\u25cf \"N\u00e9os, H\u00c9ROS \u00c9l\u00e9mentaire\"\n\u25cf Monstre \"Cristal Ultime\"\n\u25cf Monstre VENT \"Dragon Arm\u00e9\" (trait\u00e9 comme un monstre Invoqu\u00e9 Sp\u00e9cialement par l'effet d'un monstre \"Dragon Arm\u00e9\")"
    },
    "ja": {
      "name": "\u30c9\u30e9\u30b4\u30cb\u30c3\u30af\u30fb\u30b3\u30f3\u30bf\u30af\u30c8",
      "effect": "\u3053\u306e\u30b9\u30ad\u30eb\u306e\u2461\u306e\u52b9\u679c\u306f\u300c\u7a76\u6975\u5b9d\u7389\u795e \u30ec\u30a4\u30f3\u30dc\u30fc\u30fb\u30c9\u30e9\u30b4\u30f3\u300d\u3092\u5165\u308c\u3066\u3044\u308b\u30c7\u30c3\u30ad\u3067\uff11\u30bf\u30fc\u30f3\u306b\uff11\u5ea6\u3060\u3051\u4f7f\u7528\u3067\u304d\u308b\u3002\n\u2460\uff1a\u81ea\u5206\u306f\u300c\u30cd\u30aa\u30b9\u300d\u300c\u30e6\u30d9\u30eb\u300d\u300c\uff25\u30fb\uff28\uff25\uff32\uff2f\u300d\u300c\uff2e\u300d\u30e2\u30f3\u30b9\u30bf\u30fc\u3057\u304b\u7279\u6b8a\u53ec\u559a\u3067\u304d\u306a\u3044\u3002\n\u2461\uff1a\u81ea\u5206\u306e\u624b\u672d\u30fb\u30d5\u30a3\u30fc\u30eb\u30c9\uff08\u8868\u5074\u8868\u793a\uff09\u304b\u3089\u3001\u6226\u58eb\u65cf\u30e2\u30f3\u30b9\u30bf\u30fc\u304b\u30ec\u30d9\u30eb\uff11\uff10\u30e2\u30f3\u30b9\u30bf\u30fc\uff11\u4f53\u3092\u5893\u5730\u3078\u9001\u3063\u3066\u767a\u52d5\u3067\u304d\u308b\u3002\u4ee5\u4e0b\u306e\u30e2\u30f3\u30b9\u30bf\u30fc\u306e\u5185\uff11\u4f53\u3092\u81ea\u5206\u306e\u30c7\u30c3\u30ad\u30fb\u5893\u5730\u304b\u3089\u88cf\u5074\u5b88\u5099\u8868\u793a\u3067\u51fa\u3057\uff08\u8868\u793a\u5f62\u5f0f\u5909\u66f4\u53ef\u80fd\uff09\u3001\u30c7\u30c3\u30ad\u306e\u300c\u8d85\u878d\u5408\u300d\u3068\u30c7\u30c3\u30ad\u5916\u306e\u300c\u878d\u5408\u300d\u3092\u305d\u308c\u305e\u308c\uff11\u679a\u307e\u3067\u624b\u672d\u306b\u52a0\u3048\u308b\u3002\n\u25cf\u300c\uff25\u30fb\uff28\uff25\uff32\uff2f \u30cd\u30aa\u30b9\u300d\n\u25cf\u300c\u7a76\u6975\u5b9d\u7389\u795e\u300d\u30e2\u30f3\u30b9\u30bf\u30fc\n\u25cf\u98a8\u5c5e\u6027\u306e\u300c\u30a2\u30fc\u30e0\u30c9\u30fb\u30c9\u30e9\u30b4\u30f3\u300d\u30e2\u30f3\u30b9\u30bf\u30fc\uff08\u300c\u30a2\u30fc\u30e0\u30c9\u30fb\u30c9\u30e9\u30b4\u30f3\u300d\u30e2\u30f3\u30b9\u30bf\u30fc\u306e\u52b9\u679c\u306b\u3088\u308b\u7279\u6b8a\u53ec\u559a\u6271\u3044\uff09"
    }
  },
  "cardType": "skill-dl",
  "skillType": "Legendary",
  "supports": [
    "Rainbow Dragon (Duel Links)",
    "Super Polymerization (Duel Links)",
    "Polymerization (Duel Links)",
    "Elemental HERO Neos (Duel Links)"
  ],
  "releases": [
    {
      "character": "Jaden Yuki (Duel Links)",
      "type": "trader"
    },
    {
      "character": "Jaden/Yubel",
      "type": "trader"
    }
  ],
  "externalIDs": {
    "yugipedia": [
      {
        "name": "Dragonic Contact",
        "id": 1107151
      }
    ]
  }
}