{
  "$schema": "https://raw.githubusercontent.com/DjobaDELATV/seygo_data/main/schema/v1/skill.json",
  "id": "b7eb4338-761c-447d-9012-6053d31d1520",
  "text": {
    "en": {
      "name": "Draw Sense: LIGHT",
      "effect": "Can be used before your normal draw each time your Life Points decrease by 1500. One of the cards from your normal draw this turn will be a random LIGHT monster in your Deck."
    },
    "fr": {
      "name": "Pioche de LUMI\u00c8RE",
      "effect": "Cette Comp\u00e9tence peut \u00eatre utilis\u00e9e avant votre pioche normale \u00e0 chaque fois que vos Life Points diminuent de 1 500. L'une des cartes de votre pioche normale de ce tour sera un monstre LUMI\u00c8RE al\u00e9atoire de votre Deck."
    },
    "ja": {
      "name": "\u30c9\u30ed\u30fc\u30bb\u30f3\u30b9\uff1a\u5149",
      "effect": "\u81ea\u5206\u306e\u30e9\u30a4\u30d5\u30dd\u30a4\u30f3\u30c8\u304c\uff11\uff15\uff10\uff10\u6e1b\u308b\u6bce\u306b\u4f7f\u7528\u3067\u304d\u308b\u3002\u30c9\u30ed\u30fc\u30d5\u30a7\u30a4\u30ba\u6642\u306b\u901a\u5e38\u306e\u30c9\u30ed\u30fc\u3092\u884c\u3046\u304b\u308f\u308a\u306b\u3001\u30e9\u30f3\u30c0\u30e0\u3067\u5149\u5c5e\u6027\u30e2\u30f3\u30b9\u30bf\u30fc\u3092\u30c9\u30ed\u30fc\u3059\u308b\u3002"
    }
  },
  "cardType": "skill-dl",
  "skillType": "Legendary",
  "supports": [
    "LIGHT"
  ],
  "releases": [
    {
      "character": "Seto Kaiba (Duel Links)",
      "type": "duel_reward"
    },
    {
      "character": "Yugi Muto (Duel Links)",
      "type": "duel_reward"
    },
    {
      "character": "T\u00e9a Gardner (Duel Links)",
      "type": "mission",
      "details": "Normal or Special Summon a LIGHT Monster 4 time(s) in one Duel using T\u00e9a Gardner."
    },
    {
      "character": "Ishizu Ishtar (Duel Links)",
      "type": "duel_reward"
    },
    {
      "character": "Odion (Duel Links)",
      "type": "duel_reward"
    },
    {
      "character": "Maximillion Pegasus (Duel Links)",
      "type": "duel_reward"
    },
    {
      "character": "Mokuba Kaiba (Duel Links)",
      "type": "level_up",
      "details": "Level 20"
    },
    {
      "character": "Paradox Brothers (Duel Links)",
      "type": "duel_reward"
    },
    {
      "character": "Duke Devlin (Duel Links)",
      "type": "duel_reward"
    },
    {
      "character": "Rebecca Hawkins (Duel Links)",
      "type": "duel_reward"
    },
    {
      "character": "Seto Kaiba (DSOD) (Duel Links)",
      "type": "duel_reward"
    },
    {
      "character": "Mokuba Kaiba (DSOD) (Duel Links)",
      "type": "level_up",
      "details": "Level 13"
    },
    {
      "character": "Sera (Duel Links)",
      "type": "duel_reward"
    },
    {
      "character": "Jaden Yuki (Duel Links)",
      "type": "duel_reward"
    },
    {
      "character": "Zane Truesdale (Duel Links)",
      "type": "level_up",
      "details": "Level 4"
    },
    {
      "character": "Aster Phoenix (Duel Links)",
      "type": "duel_reward"
    },
    {
      "character": "Jesse Anderson (Duel Links)",
      "type": "duel_reward"
    },
    {
      "character": "Chazz Princeton (Duel Links)",
      "type": "duel_reward"
    },
    {
      "character": "Dr. Vellian Crowler (Duel Links)",
      "type": "duel_reward"
    },
    {
      "character": "Bastion Misawa (Duel Links)",
      "type": "duel_reward"
    },
    {
      "character": "Sartorius Kumar (Duel Links)",
      "type": "level_up",
      "details": "Level 13"
    },
    {
      "character": "Jaden/Yubel",
      "type": "duel_reward"
    },
    {
      "character": "Blair Flannigan (Duel Links)",
      "type": "duel_reward"
    },
    {
      "character": "Luna (Duel Links)",
      "type": "duel_reward"
    },
    {
      "character": "Dark Signer Rex Goodwin",
      "type": "duel_reward"
    },
    {
      "character": "Sherry LeBlanc (Duel Links)",
      "type": "duel_reward"
    },
    {
      "character": "Z-one (Duel Links)",
      "type": "duel_reward"
    },
    {
      "character": "Tori Meadows (Duel Links)",
      "type": "duel_reward"
    },
    {
      "character": "Kite Tenjo (Duel Links)",
      "type": "duel_reward"
    },
    {
      "character": "Trey (Duel Links)",
      "type": "duel_reward"
    },
    {
      "character": "Quinton (Duel Links)",
      "type": "duel_reward"
    },
    {
      "character": "Mizar (Duel Links)",
      "type": "duel_reward"
    },
    {
      "character": "Dumon (Duel Links)",
      "type": "duel_reward"
    },
    {
      "character": "Zuzu Boyle (Duel Links)",
      "type": "duel_reward"
    },
    {
      "character": "Dennis McField (Duel Links)",
      "type": "duel_reward"
    },
    {
      "character": "Blue Angel (Duel Links)",
      "type": "level_up",
      "details": "Level 13"
    }
  ],
  "externalIDs": {
    "yugipedia": [
      {
        "name": "Draw Sense: LIGHT",
        "id": 714690
      }
    ]
  }
}