{
  "$schema": "https://raw.githubusercontent.com/DjobaDELATV/seygo_data/main/schema/v1/skill.json",
  "id": "10fbe005-f7a2-46c3-9819-413897ffdbd8",
  "text": {
    "en": {
      "name": "Fossil Warriors",
      "effect": "At the beginning of the Duel, add 1 \"Weathering Soldier\", 1 \"Gaia Plate the Earth Giant\", and 1 \"Fossil Fusion\" to your Deck and 1 \"Fossil Warrior Skull King\", 1 \"Fossil Warrior Skull Knight\", and 1 \"Fossil Warrior Skull Bone\" to your Extra Deck.\nCan be used if your Life Points are at 2000 or below. Send 1 Rock-Type monster in your hand to the Graveyard and add 1 \"Fossil Fusion\" to your hand from your Deck or Graveyard.\nThis Skill can only be used once per Duel."
    },
    "fr": {
      "name": "Guerriers Fossiles",
      "effect": "Au d\u00e9but du Duel, ajoutez 1 \"Soldat M\u00e9t\u00e9o\", 1 \"Gaia, G\u00e9ant de Terre\" et 1 \"Fusion Fossile\" \u00e0 votre Deck, ainsi que 1 \"Guerrier Fossile Chevalier Squelette\" et 1 \"Guerrier Fossile Monstre Squelette\" \u00e0 votre Extra Deck.\nCette Comp\u00e9tence peut \u00eatre utilis\u00e9e si vos Life Points sont de 2 000 ou moins. Envoyez 1 monstre de Type Rocher de votre main au Cimeti\u00e8re et ajoutez 1 \"Fusion Fossile\" depuis votre Deck ou votre Cimeti\u00e8re dans votre main.\nCette Comp\u00e9tence ne peut \u00eatre utilis\u00e9e qu'une fois par Duel."
    },
    "ja": {
      "name": "\u53e4\u751f\u4ee3\u306e\u5316\u77f3\u9a0e\u58eb",
      "effect": "\u30c7\u30e5\u30a8\u30eb\u958b\u59cb\u6642\u306b\u3001\u81ea\u5206\u306e\u30c7\u30c3\u30ad\u306b\u300c\u98a8\u5316\u6226\u58eb\u300d\u300c\u5730\u7403\u5de8\u4eba\u30ac\u30a4\u30a2\u30fb\u30d7\u30ec\u30fc\u30c8\u300d\u300c\u5316\u77f3\u878d\u5408\u30d5\u30a9\u30c3\u30b7\u30eb\u30fb\u30d5\u30e5\u30fc\u30b8\u30e7\u30f3\u300d\u3092\uff11\u679a\u305a\u3064\u3001\u81ea\u5206\u306e\u30a8\u30af\u30b9\u30c8\u30e9\u30c7\u30c3\u30ad\u306b\u300c\u53e4\u751f\u4ee3\u5316\u77f3\u9a0e\u58eb\u30b9\u30ab\u30eb\u30ad\u30f3\u30b0\u300d\u300c\u4e2d\u751f\u4ee3\u5316\u77f3\u9a0e\u58eb\u30b9\u30ab\u30eb\u30ca\u30a4\u30c8\u300d\u300c\u65b0\u751f\u4ee3\u5316\u77f3\u9a0e\u58eb\u30b9\u30ab\u30eb\u30dd\u30fc\u30f3\u300d\u3092\uff11\u679a\u305a\u3064\u8ffd\u52a0\u3059\u308b\u3002\n\u307e\u305f\u3001\u81ea\u5206\u306e\u30e9\u30a4\u30d5\u30dd\u30a4\u30f3\u30c8\u304c\uff12\uff10\uff10\uff10\u4ee5\u4e0b\u306e\u6642\u306b\u4f7f\u7528\u3067\u304d\u308b\u3002\u624b\u672d\u306e\u5ca9\u77f3\u65cf\u30e2\u30f3\u30b9\u30bf\u30fc\uff11\u679a\u3092\u5893\u5730\u3078\u9001\u308a\u3001\u30c7\u30c3\u30ad\u30fb\u5893\u5730\u304b\u3089\u300c\u5316\u77f3\u878d\u5408\u30d5\u30a9\u30c3\u30b7\u30eb\u30fb\u30d5\u30e5\u30fc\u30b8\u30e7\u30f3\u300d\uff11\u679a\u3092\u624b\u672d\u306b\u52a0\u3048\u308b\u3002\n\u3053\u306e\u30b9\u30ad\u30eb\u306f\u30c7\u30e5\u30a8\u30eb\u4e2d\u306b\uff11\u5ea6\u306e\u307f\u4f7f\u7528\u3067\u304d\u308b\u3002"
    }
  },
  "cardType": "skill-dl",
  "skillType": "Legendary",
  "supports": [
    "Weathering Soldier (Duel Links)",
    "Gaia Plate the Earth Giant (Duel Links)",
    "Fossil Fusion (Duel Links)",
    "Fossil Warrior Skull King (Duel Links)",
    "Fossil Warrior Skull Knight (Duel Links)",
    "Fossil Warrior Skull Bone (Duel Links)"
  ],
  "releases": [
    {
      "character": "Jim \"Crocodile\" Cook (Duel Links)",
      "type": "level_up",
      "details": "Level 1"
    }
  ],
  "externalIDs": {
    "yugipedia": [
      {
        "name": "Fossil Warriors",
        "id": 715011
      }
    ]
  }
}