{
  "$schema": "https://raw.githubusercontent.com/DjobaDELATV/seygo_data/main/schema/v1/skill.json",
  "id": "b754904e-367c-47e3-bfd1-e6df04230b8c",
  "text": {
    "en": {
      "name": "LP Boost: S8",
      "effect": "You can use this Skill's first and second effects if your Extra Deck contains 2 or more Level 8 or lower Synchro Monsters.\n1: At the beginning of the Duel, gain 1600 LP.\n2: During the End Phase of a turn you Special Summoned a Level 8 or lower Synchro Monster, gain 400 LP."
    },
    "fr": {
      "name": "Boost de LP : S8",
      "effect": "Vous pouvez utiliser le premier et le deuxi\u00e8me effet de cette Comp\u00e9tence si votre Extra Deck contient min. 2 Monstres Synchro de max. Niveau 8.\n1 : Au d\u00e9but du Duel, gagnez 1 600 LP.\n2 : Pendant la End Phase du tour o\u00f9 vous avez Invoqu\u00e9 Sp\u00e9cialement un Monstre Synchro de max. Niveau 8, gagnez 400 LP."
    },
    "ja": {
      "name": "\uff2c\uff30\u5897\u5f37\uff1a\uff33\uff18",
      "effect": "\u3053\u306e\u30b9\u30ad\u30eb\u306e\u2460\u2461\u306e\u52b9\u679c\u306f\uff25\uff38\u30c7\u30c3\u30ad\u306b\u30e9\u30f3\u30af\uff18\u4ee5\u4e0b\u306e\u30b7\u30f3\u30af\u30ed\u30e2\u30f3\u30b9\u30bf\u30fc\u3092\uff12\u4f53\u4ee5\u4e0a\u5165\u308c\u3066\u3044\u308b\u30c7\u30c3\u30ad\u3067\u4f7f\u7528\u3067\u304d\u308b\u3002\n\u2460\uff1a\u30c7\u30e5\u30a8\u30eb\u958b\u59cb\u6642\u306b\u767a\u52d5\u3059\u308b\u3002\u81ea\u5206\u306f\uff11\uff16\uff10\uff10\uff2c\uff30\u56de\u5fa9\u3059\u308b\u3002\n\u2461\uff1a\u81ea\u5206\u304c\u30ec\u30d9\u30eb\uff18\u4ee5\u4e0b\u306e\u30b7\u30f3\u30af\u30ed\u30e2\u30f3\u30b9\u30bf\u30fc\u3092\u7279\u6b8a\u53ec\u559a\u3057\u305f\u30bf\u30fc\u30f3\u306e\u30a8\u30f3\u30c9\u30d5\u30a7\u30a4\u30ba\u306b\u767a\u52d5\u3059\u308b\u3002\u81ea\u5206\u306f\uff14\uff10\uff10\uff2c\uff30\u56de\u5fa9\u3059\u308b\u3002"
    }
  },
  "cardType": "skill-dl",
  "skillType": "Legendary",
  "supports": [
    "Synchro Monster"
  ],
  "releases": [
    {
      "character": "Yusei Fudo (Duel Links)",
      "type": "trader"
    },
    {
      "character": "Jack Atlas (Duel Links)",
      "type": "trader"
    },
    {
      "character": "Crow Hogan (Duel Links)",
      "type": "trader"
    },
    {
      "character": "Akiza Izinski (Duel Links)",
      "type": "trader"
    },
    {
      "character": "Leo (Duel Links)",
      "type": "trader"
    },
    {
      "character": "Luna (Duel Links)",
      "type": "trader"
    },
    {
      "character": "Antinomy (Duel Links)",
      "type": "trader"
    },
    {
      "character": "Officer Tetsu Trudge (Duel Links)",
      "type": "trader"
    },
    {
      "character": "Dark Signer Kalin Kessler",
      "type": "trader"
    },
    {
      "character": "Dark Signer Carly Carmine",
      "type": "trader"
    },
    {
      "character": "Dark Signer Rex Goodwin",
      "type": "trader"
    },
    {
      "character": "Kalin Kessler (Duel Links)",
      "type": "trader"
    },
    {
      "character": "Sherry LeBlanc (Duel Links)",
      "type": "trader"
    },
    {
      "character": "Yuya Sakaki (Duel Links)",
      "type": "trader"
    },
    {
      "character": "Yugo (Duel Links)",
      "type": "trader"
    },
    {
      "character": "Rin (Duel Links)",
      "type": "duel_reward"
    },
    {
      "character": "Gong Strong (Duel Links)",
      "type": "trader"
    },
    {
      "character": "Declan Akaba (Duel Links)",
      "type": "trader"
    },
    {
      "character": "Playmaker and Ai",
      "type": "trader"
    }
  ],
  "externalIDs": {
    "yugipedia": [
      {
        "name": "LP Boost: S8",
        "id": 1079034
      }
    ]
  }
}